utterance_order,transcription,start_time,end_time,debater
0,Pode começar debatedor 1.,5,6,MODERATOR
1,"É minha identificação, é o número 1. Estou contribuindo para a pesquisa no Brasil.",7.2,11.24,DEBATER1
2,"Minha identificação é o número 2, estou contribuindo para pesquisa no Brasil.",13.12,16.32,DEBATER2
3,3]: Minha indicação é o número 3 e estou contribuindo com a pesquisa no Brasil.,18.78,23,DEBATEDOR
4,Minha identificação é o número 4. Estou contribuindo para a pesquisa no Brasil.,24.3,28.7,DEBATER4
5,Minha identificação é o número 5. Estou contribuindo com a pesquisa no Brasil.,30.75,35.39,DABATEDOR5
6,"Antes de mergulhar-mos na nossa discussão. É essencial que todos compreendam e sigam as regras do debate. Essas regras foram criadas para garantir um debate justo e ordenado para todos os envolvidos. Primeira regra sem interrupções. Os debatedores não devem interromper uns aos outros enquanto alguém estiver falando, se você deseja falar, contribuir para a discussão, oferecer algum contra argumento, por favor, levante a mão e aguarde moderador, que sou eu, lhe conceder a palavra, uma vez que tenha sido autorizada a falar que você terá a palavra e poderá expressar seus pensamentos e responder aos outros. Vamos seguir formato estruturado, dividido em 3 momentos distintos, cada um com seus propósitos e regras específicas. Momento um primeiro momento abordaremos a questão principal do debate e o objetivo é que cada participante expresse sua opinião inicial sobre o tema central, momento 2 teremos uma rodada de perguntas direcionado para cada um dos debatedores. Abriremos espaço para os outros participantes, contra argumentarem ou expressarem suas opiniões sobre as respostas dadas. Após as perguntas direcionadas, teremos uma última pergunta que será direcionada a todos os participantes. Neste momento, você tem a Liberdade de escolher se desejam responder caso sintam que tenha algo relevante a acrescentar. No terceiro e ultimo momento, será perguntado se os participantes tem alguma outra colocação final sobre o tema, certo? Alguém ficou com alguma dúvida? São 3 momentos, primeiro momento, cada um dá sua opinião inicial sobre o tema. Segundo, tem a rodada de perguntas, que vai ser uma pergunta direcionada para cada pessoa. Mas os outros depois podem contra argumentar ou responder ou comentar alguma coisa. E terceiro, é basicamente você dar sua opinião final, depois do debate sua opinião mudou em algo, algo diferente do que era do que era antes? Enfim, consideração dos finais, certo? hmmm. Posso começar? Como todo mundo sabe, o tema do debate é inteligência artificial generativa e seus impactos na sociedade. Certo. Primeiramente, cada um terá um momento inicial para expressar suas principais opiniões e pensamento sobre o tema. Cada debatedor terá esse momento. Vamos começar pelo debatedor 1. Pode começar",41.47,176,MODERATOR
7,É...sobre par dar minha opinião sobre o tema é isso?,174,179,DEBATER1
8,"Isso, de forma geral. Qual sua opinião sobre o tema?",179,182,MODERATOR
9,"Eu acho que é um debate bastante pertinente, porque cada vez mais... É, a inteligência artificial, vai se integrando ao nosso dia a dia e, principalmente, na questão ética e do mercado de trabalho essa discussão tem muita relevância.",182,198,DEBATER1
10,Debatedor 2.,200,201,MODERATOR
11,"Também acho que o tema é importante. <É> hoje em dia, cada vez mais todas as coisas estão se integrando com inteligência artificial <E> Isso tem pontos negativos e positivos é como, por exemplo, a escola e né os os alunos estão deixando de praticar as atividades e praticar a pesquisa, pesquisar usando inteligência artificial e da cctrl c e ctrl v nas resposta e como positivos é a rapidez e eficiência das coisas no dia a dia.",202,240,DEBATER2
12,Debatedora 3.,241,242,MODERATOR
13,"Bom, de forma geral eu considero um tema bastante pertinente e relevante e é interessante falar sobre ele, porque é inevitável o mundo, de alguma forma vai chegar a esse ponto e a gente precisa debater quais serão os limites até onde ela vai chegar, quais são os benefícios, porque esse é um tema que <É>. Traz tanto benefícios como malefícios. É como se fosse equivalente. Ao mesmo tempo que traz benefícios para a sociedade. vai trazer também malefícios , então é isso a gente tem que discutir quais são os limite da inteligência artificial generativa.",243,287,DEBATER3
14,Debatedora 4.,288,290,MODERATOR
15,"Eu também concordo que considerando que é um tema bastante atual, é um debate pertinente para que a gente possa analisar os impactos sejam negativos ou positivos sobre a inteligência artificial em cada âmbito da sociedade.",290,304,DEBATER4
16,Debatedor 5.,305,306,MODERATOR
17,"Eu acredito na relevância do tema, pois inteligência artificial, surgiu para ficar. Ela vai ser, com certeza, aprimorada com a maioria querendo isso ou não e ela sendo feita de maneira descontrolada, sem nenhum cuidado ou regulamentação, é um perigo para vários setores da sociedade. O setor educativo, que é totalmente afetado devido aos Atalhos que essa ferramenta faz e o mercado de trabalho também a inteligência artificial tem poder de substituir muitas coisas, então é um. É um setor artifício que tem que ser aprimorado com cuidado e com com responsabilidade.",307,349,DEBATER5
18,"Vamos iniciar uma rodada de perguntas, irei realizar uma pergunta para cada participante, que terá seu tempo de resposta e ao final de sua resposta, os demais podem pedir espaço para comentar algo sobre a pergunta feita ou então a resposta dada, certo? Vamos começar. A primeira pergunta para o debatedor 1. Se um sistema de Ia generativa criar criar algo prejudicial ou ofensivo, por exemplo, uma imagem com conteúdo racista, quem deve ser responsabilizado? O desenvolvedor da IA? usuário? a plataforma que hospeda ou alguma outra instituição ou pessoa.",357,392,MODERADOR
19,"É, na minha concepção o responsabilizado deve ser o desenvolvedor da IA, porque é ele quem faz e trabalha com aprendizado de máquina. É ele quem faz a IA aprender, e ele quem trabalha com filtro da própria IA. Assim como o chat GPT tem seus filtros, é feitos pela própria open AI. É se alguma IA tem algum sistema é ofensivo, racista ou qualquer coisa assim, a responsabilidade é do desenvolvedor.",393,420,DEBATER1
20,"Alguém tem algo sobre a comentar sobre a resposta do debatedor 1? Não? Okay, vou passar para a segunda pergunta. Vou fazer a segunda pergunta para o debatedor 2. IA generativas podem ser usadas nos processos educacionais? por exemplo, em aulas, em aula, atividades ou provas, o aluno deve reportar ao professor sobre o uso de IA generativas em suas atividades.",422,451,MODERATOR
21,"Eu acho que pode sim ser usado <É> eu utilizo para, quando tem alguma questão que eu acho difícil estou tentando há 2 horas fazer e não consigo. Eu peço dicas a IA, ao chatGPT e ele me retorna as dicas e com essas dicas, eu tenho que trabalhar em cima para melhorar meu código ou algo do tipo, então eu acho que pode sim utilizar nos momentos certos e nas oportunidades certas. Não usar essas ferramentas de não você vai se viciar e tem que usar sempre com controle . E também eu acho que o professor deve o aluno se usou em um trabalho tem que colocar tem que avisar ao professor <é> para não ser tipo uma trapaça e como todo projeto tem que ter suas referências, então acho que tem que avisar sim.",451,508,DEBATER2
22,"Okay, alguém tem algumas coisa a comentar? Debatedora 3",510,513,MODERATOR
23,Posso dar um contra ponto?,514,515,DEBATER3
24,Pode.,515,515,MODERADOR
25,"Eu também acho que não deve limitar, né? uma ferramenta que é bastante útil . Só que eu acho que depende bastante da faixa etária. Por exemplo, nós já temos maturidade para saber dos impactos disso. Por exemplo, se eu tenho uma questão complicada para resolver e eu procuro lá, eu estou. Eu sei dos impactos que eu estou é renunciando um esforço para aprender aquilo e responder àquela questão, então eu sei que isto, de certa forma, vai gerar prejuízo posteriormente. Mas uma criança que está em pleno é em pleno desenvolvimento, começando agora as suas caminhadas. Se ela tiver acesso a isso. É, com certeza não vai aprender da mesma forma como nós aprendemos o ensino infantil, porque nós precisamos menos esforçar em tudo que vem com esforço, geralmente tem mais resultado. Então eu acho que, por exemplo, para crianças, isso não seria útil de forma alguma, porque seriam atalhos e para mim atalhos não são tão interessantes.",517,580,DEBATER3
26,Debatedor 2 tem algo a comentar sobre a resposta da debatedora 3?,571.53,574.49,MODERATOR
27,"Mais alguém tem alguma coisa a comentar sobre a pergunta, sobre as respostadas dadas?",576.47,579.95,MODERATOR
28,Não?,582.2,582.32,MODERATOR
29,"Certo, eu vou ler agora a pergunta 3 pra debatedora 3.",584.07,586.87,MODERATOR
30,"De que maneira a propriedade intelectual deve ser tratada por um conteúdo é gerado por uma IA, por exemplo, se o usuário gerou uma música usando IA, o crédito pela criação, deve ser deste usuário, da plataforma de IA utilizada, do criador dos dados originais com as quais a IA foi treinada?",588.15,605.67,MODERATOR
31,A quem deve ser atribuída... Esse esse título no caso da música?,622,625,DEBATER3
32,"Isso, a propriedade intelectual dessa música.",616.28,619,MODERATOR
33,"A pessoa que fez o trabalho, então, para mim, continua valendo. A pessoa que fez o trabalho, então, para mim, continua valendo, esse essa regra de propriedade intelectual. A IA deveria ter sentimentos nesse caso, acho isso.",630.83,653,DEBATER3
34,"Quando fala limites, tem algum exemplo para dar?",655,657,MODERATOR
35,"Ixe, agora eu não consigo pensar.",663,665,DEBATER3
36,"Certo. Alguém tem algo a comentar da resposta da debatedora 2, 3. Pode falar debatedor 2.",666,673,MODERATOR
37,"Eu concordo que deve ser do usuário o titulo mas... Tem que ser, tem que ter aqueles créditos para a IA. Por ter... Sido a plataforma que desenvolveu, e os meios que ele utilizou para desenvolver o sistema.",673,687,DEBATER2
38,"A debatedora 3 tem algo a comentar sobre a resposta do debatedor 2? Não? Mais alguém tem algo a comentar sobre a pergunta? sobre as respostas dadas? Okay, certo. Eu vou ler a pergunta 4 para a debatedora 4. Como garantir que conteúdos gerados por IA generativas não sejam usados para espalhar tendenciosas, errôneas ou maliciosas. Por exemplo, quando esse tipo de informação é propagadas massivamente por boots em uma rede social. A responsabilidade deve ser da empresa que administra a rede social, dos programadores da IA, da ia ou de quem produziu aquele conteúdo usando a IA?",688,728,MODERATOR
39,Eu acho que a responsabilidade seria de quem produziu o conteúdo. Creio que ainda tem essa ideia de limites de que o desenvolvedor tem que colocar certos limites na inteligência artificial só que continua tendo a responsabilidade de quem produziu o conteúdo.,732,746,DEBATER4
40,"Então, pra tu a responsabilidade é sempre da pessoa que produziu conteúdo, unicamente dela?",748,753,MODERATOR
41,Nesse caso.,754,754,DEBATER4
42,"Ok, alguém tem algo a comentar sobre a resposta da debatedora 4? Todo mundo concorda com ela? Certo, alguém de forma geral sobre a pergunta ou a resposta dela, tem algo a comentar sobre esse tema? não, okay...vou passar para a próxima pergunta. Agora eu vou dar a pergunta 5 para o debatedor 5. Quais os embates da IA no ambiente de trabalho? Você acha que o uso de IAs generativas irá gerar ou destruir empregos? Por exemplo, IA gerativa que consegue fazer o trabalho de um arquiteto ou publicitário de forma mais rápida fará um trabalho totalmente confiável.",756,794,MODERATOR
43,"Eu acho que em poucos casos, em trabalhos que não requerem muito conhecimento técnico ou formação académica. A IA pode sim substituir totalmente. Em poucos, mas eu acho que na grande maioria, o profissional que usa a IA, que tem domínio sobre a IA, esse sim vai substituir o profissional que não usa a IA, que ignora ela, porque eu acho que a IA está aí pra servir, pra ajudar o profissional que já é qualificado a ter uma ajuda muito potencial, sem limites",797.32,828,DEBATER5
44,"Alguém tem algo a comentar sobre a resposta do debatedor 5? Mais alguém tem alguma colocação sobre a pergunta, sobre a resposta? Ok, Agora eu vou fazer uma pergunta direcionada a todo grupo. Qualquer um dos debates pode responder, só pedir a vez. O uso e o desenvolvimento de IAs genertavias devem ser fortemente fiscalizados por órgãos governamentais, ou elas são apenas mais um tipo de software como, como milhares de outros existentes? Alguém tem algo a comentar sobre essa pergunta? Sobre esse problema? Vocês acham que o governo deveria... Interceder de alguma forma no desenvolvimento de IAs generativas? Debatedora 3",830,884,MODERATOR
45,"No primeiro momento, com o conhecimento que eu tenho, obviamente, talvez não seja tão profundo. Talvez não fortemente, mas claro que que em algum momento isso vai ser preciso, né? O governo intervir. Porque se o próprio Elon Musk deixou open, é... A empresa que ele estava envolvido como fundador. Deixou com medo de alguns riscos. Quem sou eu pra dizer que que a IA não vai ter riscos ao ponto de precisar sim de que o governo entre fazendo alguma ação? Então, como eu estou dizendo desde início, vai precisar. É... De certa forma, em alguns contextos, sim, que o governo atue.",885,925,DEBATER3
46,Ok. Alguém tem algum comentário sobre a resposta da debatedora 3? ou sobre a questão proposta? Não?,926,937,MODERATOR
47,3]: Posso. Posso falar?,938,938,Debatedora
48,"Pode, pode falar, debatedora 3.",940,941,MODERATOR
49,"É, por exemplo, eu eu tô falando de limites, mas... É porque eu acho assim, que...Em alguns casos, realmente a IA é interessante ser aplicada, como por exemplo, na tes, na Tesla justamente de Elon Musk, ele tá usando a IA pra automatizar os casos. Então aí faz sentido usar. Mas tem locais com risco, reproduzir imagens, reproduzir músicas que... Talvez não seja tão interessante, se bem que....É... Isso, vai obrigar as pessoas a fazer algo singular e único. Porque... A própria IA já vai estar gerando algo semelhante, então, cada vai ter que ralar mais para produzir algo que seja singular e único na sociedade, então acho que isso vai demandar mais das pessoas.",942,986,DEBATER3
50,"Ok. Alguém tem algum comentário sobre a resposta da debatedora 3? Não? Certo, vou finalizar aqui a gravação, certo?",988,997,MODERATOR
